first_name,result,series,episode,last_name,baker_age,baker_occupation,hometown,signature_bake,show_stopper,technical
Michelle,OUT,10,5,NA,NA,NA,NA,NA,NA,7
Miranda,IN,1,1,Browne,37,Food buyer for Marks & Spencer,"Midhurst, West Sussex","Triple Layered Brownie Meringue Cake
with Raspberry Cream",Three Tiered Chocolate Fudge Cake  with Handmade Chocolate Button Decorations,8
Miranda,IN,1,2,Browne,37,Food buyer for Marks & Spencer,"Midhurst, West Sussex",Fresh Vanilla Biscuits with Royal Icing,Pistachio Macarons,3
Miranda,IN,1,3,Browne,37,Food buyer for Marks & Spencer,"Midhurst, West Sussex",Walnut and Apricot Bread,"Lemon Iced Buns
Chocolate and Orange Buns",3
Miranda,IN,1,4,Browne,37,Food buyer for Marks & Spencer,"Midhurst, West Sussex",Sticky Toffee Pudding,"Queen of Puddings, Chocolate Pear Roly Poly, Strawberry and Rhubarb Crumble",1
Miranda,IN,1,5,Browne,37,Food buyer for Marks & Spencer,"Midhurst, West Sussex","Summery Salmon, Cod and Prawn Fish Pie","Chocolate Pastry filled with Orange Cheesecake  Chocolate Pastry filled with Milk Chocolate Ganche  Strawberry Tart with Red Currant Glaze  Cheesy Crab, Broad Bean and Tomato, Pancetta Risotto Canapés",1
Miranda,Runner-up,1,6,Browne,37,Food buyer for Marks & Spencer,"Midhurst, West Sussex",Lemon Cupcake,Eliminated after signature,NA
Nadiya,IN,6,1,Hussain,30,Full-time mother,Leeds / Luton,Orange and Green Cardamom Madeira Cake,Quadruple Chocolate Black Forest Gâteau,12
Nadiya,IN,6,2,Hussain,30,Full-time mother,Leeds / Luton,"Coconut, Fennel and Pistachio Biscotti",Box of Fortunes,9
Nadiya,IN,6,3,Hussain,30,Full-time mother,Leeds / Luton,Mexican Bread with Warm Tomato Salsa,Snake Charmer's Basket,9
Nadiya,IN,6,4,Hussain,30,Full-time mother,Leeds / Luton,Cinnamon Tea Crème Brûlées,Fizzy Pop Cheesecakes,8
Nadiya,STAR BAKER,6,5,Hussain,30,Full-time mother,Leeds / Luton,Naked Blueberry and Caraway Crunch Cake,Chocolate and Strawberry Lime Ice Cream Roll,1
Nadiya,IN,6,6,Hussain,30,Full-time mother,Leeds / Luton,"Bay Leaf, Rong Tea and Pear Tart",Bengali Korma and Clementine with Cod Vol-au-vents,4
Nadiya,IN,6,7,Hussain,30,Full-time mother,Leeds / Luton,Aromatic Raised Game Pie,Mango and Raspberry Charlotte Russe,1
Nadiya,STAR BAKER,6,8,Hussain,30,Full-time mother,Leeds / Luton,Rose Pistachio and Mocha Hazelnut Horns,Bubble Gum and Peppermint Cream Religieuse à l'ancienne,1
Nadiya,STAR BAKER,6,9,Hussain,30,Full-time mother,Leeds / Luton,Peanut Salted Caramel and Chocolate Tart,Peacock in Nan's Door,4
Nadiya,WINNER,6,10,Hussain,30,Full-time mother,Leeds / Luton,Cardamom and Almond Buns & Nutmeg and Sour Cherry Fingers,My Big Fat British Wedding Cake,1
Nancy,STAR BAKER,5,1,Birtwhistle,60,Retired Practice Manager,"Barton-upon-Humber, Lincolnshire",Coffee and Hazelnut Swiss Roll,Jaffa Orange Cakes,1
Nancy,IN,5,2,Birtwhistle,60,Retired Practice Manager,"Barton-upon-Humber, Lincolnshire",Fennel and Rye Thins,Hansel and Gretel Scene,2
Nancy,IN,5,3,Birtwhistle,60,Retired Practice Manager,"Barton-upon-Humber, Lincolnshire",Cider and Walnut Crusty Rolls,'Full English' Stromboli,5
Nancy,IN,5,4,Birtwhistle,60,Retired Practice Manager,"Barton-upon-Humber, Lincolnshire",Pistachio Puddings with Chocolate Sauce,Summer Pudding Alaska,4
Nancy,IN,5,5,Birtwhistle,60,Retired Practice Manager,"Barton-upon-Humber, Lincolnshire",Chocolate Crusted Passion Fruit Tart,Trio of Apple Pies,4
Nancy,IN,5,6,Birtwhistle,60,Retired Practice Manager,"Barton-upon-Humber, Lincolnshire",Rum Punch Savarin with Coconut Cream and Tropical Fruits,Chocolate and Caramel Dobos Torte,1
Nancy,IN,5,7,Birtwhistle,60,Retired Practice Manager,"Barton-upon-Humber, Lincolnshire",Spicy Duck Pasties,Smoked Salmon and Horseradish & Raspberry Ripple Éclairs,2
Nancy,IN,5,8,Birtwhistle,60,Retired Practice Manager,"Barton-upon-Humber, Lincolnshire",Lincolnshire Plum Braid,"Doughnut Family Tree
(Limoncello and Almond & Milk Chocolate and Orange)",3
Nancy,IN,5,9,Birtwhistle,60,Retired Practice Manager,"Barton-upon-Humber, Lincolnshire",Coffee and Chocolate BaklavaBreakfast Baklava,Raspberry NonnettesLime and Passion Fruit Entremets,3
Nancy,WINNER,5,10,Birtwhistle,60,Retired Practice Manager,"Barton-upon-Humber, Lincolnshire",Apple and Lemon KitesRaspberry and Almond Croissants,Red Windmill,1
Natasha,OUT,3,1,Stringer,36,Midwife,"Tamworth, Staffordshire",Pineapple & Passion Fruit,Mother's Day Layered Rose Cake,12
Norman,IN,5,1,Calder,66,Retired Naval Officer,"Portknockie, Moray",Black Forest Swiss Roll,Almond and Raspberry Mini Cakes,11
Norman,IN,5,2,Calder,66,Retired Naval Officer,"Portknockie, Moray",Farthing Biscuits,Zulu Boats at Dawn,10
Norman,IN,5,3,Calder,66,Retired Naval Officer,"Portknockie, Moray",Rye Bread Rolls,Chicken and Roasted Vegetable Picnic Loaf,4
Norman,IN,5,4,Calder,66,Retired Naval Officer,"Portknockie, Moray",Mini Sticky Toffee Puddings,Baked Alaska with Strawberry Surprise,8
Norman,OUT,5,5,Calder,66,Retired Naval Officer,"Portknockie, Moray",Tarte au Citron,Pieful Tower,5
Paul,IN,6,1,Jagger,49,Prison governor,"Swansea, Wales","Lemon, Ginger and Caraway Seed Madeira Cake",Black Forest Chocolate Creation,10
Paul,IN,6,2,Jagger,49,Prison governor,"Swansea, Wales","Chocolate, Hazelnut and Fig Biscotti",Memory Box,10
Paul,IN,6,3,Jagger,49,Prison governor,"Swansea, Wales",Cranberry and Orange Sweet Soda Breads,King of the Jungle,10
Paul,IN,6,4,Jagger,49,Prison governor,"Swansea, Wales",Almond Crème Brûlées,Berry Cheesecake Tower,1
Paul,IN,6,5,Jagger,49,Prison governor,"Swansea, Wales",Carrot & Pecan Cake,Dessert Island Getaway,2
Paul,IN,6,6,Jagger,49,Prison governor,"Swansea, Wales",Christmas Frangipane Tart,Savoury and Sweet Bouchées,5
Paul,IN,6,7,Jagger,49,Prison governor,"Swansea, Wales",Not a Boaring Pie,Charlotte Rose,2
Paul,OUT,6,8,Jagger,49,Prison governor,"Swansea, Wales",Café Tipple & Banana Crunch-away Horns,Religieuse à l'ancienne,5
Peter,IN,3,1,Maloney,43,Sales manager,"Windsor, Berkshire","Pear, Muscat & Chocolate",Jubilee Cake,3
Peter,OUT,3,2,Maloney,43,Sales manager,"Windsor, Berkshire",Fennel and Nigella Seed NaanBannock Bread,"Rosemary and Sea Salt Bagels
Apple and Cinnamon Bagels",11
Peter,OUT,8,1,Abatan,52,IT programme manager,"Southend, Essex",Coconut Cake,'Bread on a Breadboard' Cake,10
Phil,IN,10,1,NA,NA,NA,NA,NA,NA,8
Phil,IN,10,2,NA,NA,NA,NA,NA,NA,3
Phil,IN,10,3,NA,NA,NA,NA,NA,NA,10
Phil,OUT,10,4,NA,NA,NA,NA,NA,NA,6
Priya,IN,10,1,NA,NA,NA,NA,NA,NA,7
Priya,IN,10,2,NA,NA,NA,NA,NA,NA,7
Priya,IN,10,3,NA,NA,NA,NA,NA,NA,4
Priya,IN,10,4,NA,NA,NA,NA,NA,NA,10
Priya,IN,10,5,NA,NA,NA,NA,NA,NA,2
Priya,OUT,10,6,NA,NA,NA,NA,NA,NA,7
Rahul,IN,9,1,NA,NA,NA,NA,NA,NA,7
Rahul,STAR BAKER,9,2,NA,NA,NA,NA,NA,NA,2
Rahul,STAR BAKER,9,3,NA,NA,NA,NA,NA,NA,4
Rahul,IN,9,4,NA,NA,NA,NA,NA,NA,4
Rahul,IN,9,5,NA,NA,NA,NA,NA,NA,3
Rahul,IN,9,6,NA,NA,NA,NA,NA,NA,3
Rahul,IN,9,7,NA,NA,NA,NA,NA,NA,1
Rahul,IN,9,8,NA,NA,NA,NA,NA,NA,5
Rahul,IN,9,9,NA,NA,NA,NA,NA,NA,4
Rahul,WINNER,9,10,NA,NA,NA,NA,NA,NA,2
Rav,IN,7,1,Bansal,28,Student support,Erith,Ginger Spice Yuzu Drizzle Cake,Colombian Mocha Mirror Glaze Cake,8
Rav,IN,7,2,Bansal,28,Student support,Erith,Union Jack Bunting Biscuits,Gingerbread Christmas Fairground,6
Rav,IN,7,3,Bansal,28,Student support,Erith,"Chocolate, Cardamom and Hazelnut Loaf",Three Tier Diwali Bread Centrepiece,10
Rav,IN,7,4,Bansal,28,Student support,Erith,Thai Tofu Panang Yorkshires,Three Dip Matcha Pistachio Churros,9
Rav,IN,7,5,Bansal,28,Student support,Erith,"Cinnamon Swirls and Pecan, Walnut and Maple Plaits",Chinese Style Prawn Filo Tartlets and Spiced White Chocolate and Hazelnut Samosas,8
Rav,OUT,7,6,Bansal,28,Student support,Erith,Mandarin Margarita Meringue Pie,Blossom Cake,3
Richard,IN,5,1,Burr,38,Builder,"Mill Hill, London",Pistachio and Strawberry Swiss Roll,Miniature Coffee & Walnut Cakes,10
Richard,STAR BAKER,5,2,Burr,38,Builder,"Mill Hill, London",Rosemary Seeded Crackers,Pirates!,1
Richard,IN,5,3,Burr,38,Builder,"Mill Hill, London",Rye and Cranberry Rolls,Pesto Pinwheel,6
Richard,STAR BAKER,5,4,Burr,38,Builder,"Mill Hill, London",Black Forest Chocolate Fondants,Tiramisu Baked Alaska,5
Richard,IN,5,5,Burr,38,Builder,"Mill Hill, London",Fig and Orange Tart,Three Course Autumn Pie Feast,7
Richard,IN,5,6,Burr,38,Builder,"Mill Hill, London",Fruity Guglhupf with an Orange Glaze,Sugar Forest Dobos Torte,5
Richard,STAR BAKER,5,7,Burr,38,Builder,"Mill Hill, London",Minted Lamb Pasties,"Stair of Éclairs
(Lavender and Blueberry & Rose and Raspberry Éclairs)",1
Richard,STAR BAKER,5,8,Burr,38,Builder,"Mill Hill, London",Fruit Swedish Tea Ring,Rhubarb and Custard and Toffee Apple Doughnuts,4
Richard,STAR BAKER,5,9,Burr,38,Builder,"Mill Hill, London",Rose and Pistachio BaklavaWalnut and Almond Baklava,Hazelnut Mocha EntremetsPink Grapefruit Entremets,2
Richard,Runner-up,5,10,Burr,38,Builder,"Mill Hill, London",Pear Pain au ChocolatPain Au Lait,Mill on the Hill,3
Robert,IN,2,1,Billington,25,Photographer,London,Blackberry and Vanilla Cupcakeswith Liquorice Frosting,Genoise Layered Mousse Cakewith Chocolate Ganache,3
Robert,IN,2,2,Billington,25,Photographer,London,Smoked Bacon and Kale Quiche,"Chocolate, Fennel and Ginger TartAlmond, Creme Patissiere and Poached Pear Tart",5
Robert,IN,2,3,Billington,25,Photographer,London,Rye and Coriander Seed Loaf,Blueberry Brioche RollsLemon and Poppy Seed Rolls,4
Robert,IN,2,4,Billington,25,Photographer,London,Chocolate and Ginger Oat Biscuits,Strawberry and Lime MacaronsLemon MacaronsChocolate and Cardamom Macarons,7
Robert,OUT,2,5,Billington,25,Photographer,London,Chicken and Mushroom Pie,Rhubarb and Custard Meringue Pie,3
Robert,STAR BAKER,4,1,Smart,54,Space Satellite Designer,"Melbourn, Cambridgeshire",Pecan and Apple Cake,Raspberry Chocolate Cake,1
Robert,IN,4,2,Smart,54,Space Satellite Designer,"Melbourn, Cambridgeshire",Twisty Rye Bread Sticks,Tribute Loaf,5
Robert,IN,4,3,Smart,54,Space Satellite Designer,"Melbourn, Cambridgeshire",Rhubarb and Orange Trifle,Almond FriandsTurǫn Macaroons,2
Robert,IN,4,4,Smart,54,Space Satellite Designer,"Melbourn, Cambridgeshire",Apple and Pear Pie with Thyme,Spanakopita with St George's Mushrooms,3
Robert,OUT,4,5,Smart,54,Space Satellite Designer,"Melbourn, Cambridgeshire",Blueberry & Orange Traybake,Dalek,4
Rosie,IN,10,1,NA,NA,NA,NA,NA,NA,2
Rosie,IN,10,2,NA,NA,NA,NA,NA,NA,5
Rosie,IN,10,3,NA,NA,NA,NA,NA,NA,9
Rosie,IN,10,4,NA,NA,NA,NA,NA,NA,4
Rosie,IN,10,5,NA,NA,NA,NA,NA,NA,5
Rosie,IN,10,6,NA,NA,NA,NA,NA,NA,5
Rosie,IN,10,7,NA,NA,NA,NA,NA,NA,1
Rosie,IN,10,8,NA,NA,NA,NA,NA,NA,2
Rosie,OUT,10,9,NA,NA,NA,NA,NA,NA,1
Ruby,IN,4,1,Tandoh,20,History of Art and Philosophy Student,"Southend, Essex",Rhubarb and Custard Sandwich Cake,Chocolate and Ginger Night Sky Cake,12
Ruby,STAR BAKER,4,2,Tandoh,20,History of Art and Philosophy Student,"Southend, Essex",Mexican Breadsticks,White Chocolate and Orange Peacock Bread,3
Ruby,IN,4,3,Tandoh,20,History of Art and Philosophy Student,"Southend, Essex",Desert Island Trifle,Lemon Shortbread and White Chocolate SeashellsBlackberry and Chocolate Layer Cakes,3
Ruby,IN,4,4,Tandoh,20,History of Art and Philosophy Student,"Southend, Essex",Apple and Marzipan Pie,"Rose, Almond and Raspberry Filo Pie",6
Ruby,IN,4,5,Tandoh,20,History of Art and Philosophy Student,"Southend, Essex",Blackberry and Lemon Bakewell Slice,'Dropped Ice-Cream' Biscuit Centrepiece,6
Ruby,STAR BAKER,4,6,Tandoh,20,History of Art and Philosophy Student,"Southend, Essex",Citrus Tea Loaf,Twisted Swedish KanelbullarSaffron St. Lucia Buns,1
Ruby,IN,4,7,Tandoh,20,History of Art and Philosophy Student,"Southend, Essex",Plum Jam Roly-Polywith Ginger Ice cream,Raspberry and Passion Fruit Mille-feuilleCaramelised Apple LatticePortuguese Custard Tarts,2
Ruby,STAR BAKER,4,8,Tandoh,20,History of Art and Philosophy Student,"Southend, Essex",Mango and Nigella Seed Spelt Cob,Carrot Cake and Pistachio Garden Plot,1
Ruby,IN,4,9,Tandoh,20,History of Art and Philosophy Student,"Southend, Essex","Beetroot Jelly on Poppy Seed BiscuitsSpinach, Parmesan and Egg TartletsChoux Buns with Goat's Cheese and Caramelised Onions","Chocolate, Almond Praline and Saffron Opera Cake",4
Ruby,Runner-up,4,10,Tandoh,20,History of Art and Philosophy Student,"Southend, Essex",Picnic Basket Pie,"Raspberry, Lemon and Passion Fruit Wedding Cake",2
Ruby,IN,9,1,NA,NA,NA,NA,NA,NA,1
Ruby,IN,9,2,NA,NA,NA,NA,NA,NA,10
Ruby,IN,9,3,NA,NA,NA,NA,NA,NA,7
Ruby,IN,9,4,NA,NA,NA,NA,NA,NA,2
Ruby,IN,9,5,NA,NA,NA,NA,NA,NA,1
Ruby,IN,9,6,NA,NA,NA,NA,NA,NA,7
Ruby,IN,9,7,NA,NA,NA,NA,NA,NA,3
Ruby,STAR BAKER,9,8,NA,NA,NA,NA,NA,NA,3
Ruby,STAR BAKER,9,9,NA,NA,NA,NA,NA,NA,1
Ruby,Runner-up,9,10,NA,NA,NA,NA,NA,NA,3
Ruth,IN,1,1,Clemens,31,Retail manager/Housewife,"Poynton, Cheshire",Three Tiered Lemon Drizzle Cakewith Fresh Cream and freshly made Lemon Curd,Classic Chocolate Sponge wrapped in a Chocolate Collartopped with Handmade White and Dark Chocolate Truffles,NA
Ruth,IN,1,2,Clemens,31,Retail manager/Housewife,"Poynton, Cheshire",Peanut Shortbread withSalted Peanut Caramel,Almond Macaron with Violet ButtercreamRaspberries and Cream Eclairs,5
Ruth,IN,1,3,Clemens,31,Retail manager/Housewife,"Poynton, Cheshire",Maple and Pecan Bread,"Chocolate and Orange Panettone
Cranberry Bagels",2
Ruth,IN,1,4,Clemens,31,Retail manager/Housewife,"Poynton, Cheshire",Peach and Blueberry Boy Bait,"Apple & Ginger Crumble, Rhubarb Suet Crust, Cherry Queen of Puddings",4
Ruth,IN,1,5,Clemens,31,Retail manager/Housewife,"Poynton, Cheshire",Minced Beef Pie,"Raspberry and Dark Chocolate Tart  Creme Patisserie and Cherry Tart  Citrus Curd Tart with Creme Brulee top  Tomato, Asparagus Twirl Canapés",3
Ruth,Runner-up,1,6,Clemens,31,Retail manager/Housewife,"Poynton, Cheshire","Mint, Ginger and Blackberry Cake",NA,NA
Ryan,IN,3,1,Chong,38,Photographer,Bristol,Kumquat and Orange Polenta,Hidden Flowerbed Mousse Cake,8
Ryan,IN,3,2,Chong,38,Photographer,Bristol,Shanghai Spring Onion FlatbreadsGarlic and Coriander Naan,"Cinnamon and Date Bagels
Tarragon and Rosemary Bagels",5
Ryan,IN,3,3,Chong,38,Photographer,Bristol,Spiced Pear Tarte Tatin,UNKNOWN,5
Ryan,IN,3,4,Chong,38,Photographer,Bristol,Green Tea Opera Torte,"Strawberry, Rose and Pistachio Meringue",7
Ryan,STAR BAKER,3,5,Chong,38,Photographer,Bristol,Curry Spiced Seabass Wellington,Key Lime Pie,8
Ryan,IN,3,6,Chong,38,Photographer,Bristol,Chocolate FondantsSticky Ginger and Date Puddings,"Apple, Sour Cherry, Raisin and Mixed Nuts Strudel",6
Ryan,OUT,3,7,Chong,38,Photographer,Bristol,Lardy Cakes,Char Siu Bao,6
Sandy,IN,6,1,Docherty,49,Child welfare officer,"Yeadon, West Yorkshire",Madeira Cake with Almond Liqueur and Chopped Apricots,Black Forest Gâteau,9
Sandy,IN,6,2,Docherty,49,Child welfare officer,"Yeadon, West Yorkshire",Chocolate Chunk and Hazelnut Biscotti,Sundried Tomato Cheese Biscuit Box,4
Sandy,IN,6,3,Docherty,49,Child welfare officer,"Yeadon, West Yorkshire",Soda Breads with Smoked Bacon and Onion,Basket of Bread Flowers with a Walnut and Blue Cheese Centre,7
Sandy,OUT,6,4,Docherty,49,Child welfare officer,"Yeadon, West Yorkshire",Pontefract Crème Brûlées,"Cassata, Whisky and Orange & Apple Pie Cheesecakes",6
Sarah-Jane,IN,3,1,Willis,28,Vicar's wife,"Bewbush, West Sussex","Pear, Chocolate and Hazelnut",Hidden Crown Cake,1
Sarah-Jane,IN,3,2,Willis,28,Vicar's wife,"Bewbush, West Sussex",Toasted Coconut and Lime RotisOatcakes,UNKNOWN,10
Sarah-Jane,IN,3,3,Willis,28,Vicar's wife,"Bewbush, West Sussex",Caramelised Banana Tarte Tatin,French Apple Tart with Blackberry and Cassis Jam,8
Sarah-Jane,IN,3,4,Willis,28,Vicar's wife,"Bewbush, West Sussex",Chocolate and Almond Truffle Torte,Hazelnut Tiramisu Layered Meringue,4
Sarah-Jane,IN,3,5,Willis,28,Vicar's wife,"Bewbush, West Sussex",Beef Wellington with Parma Ham and Gorgonzola Cheese,Chocolate and Banana Cream Pie,4
Sarah-Jane,IN,3,6,Willis,28,Vicar's wife,"Bewbush, West Sussex",Sticky Toffee PuddingsGranny's Saucy Lemon Puddings,Sweet Strudel with Sour Cherries,4
Sarah-Jane,OUT,3,7,Willis,28,Vicar's wife,"Bewbush, West Sussex","Orange, Nutmeg and Saffron Buns",Sour Cherry and Dark Chocolate Christmas Plait,7
Selasi,IN,7,1,Gbormittah,30,Client service associate,London,Citrus and Spice Drizzle Cake,"Raspberry, Sloe and White Chocolate Mirror Glaze Cake",1
Selasi,IN,7,2,Gbormittah,30,Client service associate,London,"""Wheelie Hot Iced Biscuits""",Stained Glass Window Gingerbread Church,11
Selasi,IN,7,3,Gbormittah,30,Client service associate,London,"Chocolate, Orange and Cinnamon Bread",Bedouin Escape Tear and Share Bread,5
Selasi,IN,7,4,Gbormittah,30,Client service associate,London,Perfect Sunday Roast Accompaniment,Lemon and Anise Churros,8
Selasi,IN,7,5,Gbormittah,30,Client service associate,London,"Rhubarb, Mango and Ginger Plait, and Pineapple and Coconut Pinwheels","Parma Ham, Asparagus and Cheese Filo Cigars and Coffee Cream Filo Cups",3
Selasi,IN,7,6,Gbormittah,30,Client service associate,London,"Grapefruit, Orange and Mint Meringue Pie",Three Tiered Ombré Floral Cake,7
Selasi,IN,7,7,Gbormittah,30,Client service associate,London,Summer Picnic Roulade,"Lemon, Strawberry and Passionfruit and Chocolate and Mint Mini Mousse Cakes",6
Selasi,IN,7,8,Gbormittah,30,Client service associate,London,Bouquet of Flowers,Fruity Tudor Marchpane,3
Selasi,OUT,7,9,Gbormittah,30,Client service associate,London,"Sundried Tomato, Onion, Peppers and Parmesan Palmiers and Salmon, Spinach and Mushroom Palmiers",Lime and Ginger Fondant Fancies and Pink Velvet and Raspberry Prosecco Fondant Fancies,4
Simon,IN,2,1,Blackwell,31,Rugby Coach,Norfolk,Guinness and Chocolate Cupcakes,Two-Tiered Chocolate Courgette Cake,9
Simon,OUT,2,2,Blackwell,31,Rugby Coach,Norfolk,Smoked Haddock and Watercress Quiche,"Passion Fruit and Ricotta TartsSalted Chocolate, Stem Ginger and Mascarpone Cream Tarts",11
Sophie,IN,8,1,Faldo,33,Former army officer and trainee stuntwoman,"West Molesey, Surrey",Pineapple and Coconut Sandwich Cake,'Champagne Bottle and Bucket' Cake,5
Sophie,IN,8,2,Faldo,33,Former army officer and trainee stuntwoman,"West Molesey, Surrey",Lemon Limoncino Sandwich Biscuits,'Snakes and Ladders' Game,2
Sophie,IN,8,3,Faldo,33,Former army officer and trainee stuntwoman,"West Molesey, Surrey",Tagine Teacakes,'Picnic Basket' Bread Sculpture,6
Sophie,IN,8,4,Faldo,33,Former army officer and trainee stuntwoman,"West Molesey, Surrey",Jaffa Millionaire Shortbreads,Bird's Nest Caramel Cake,4
Sophie,STAR BAKER,8,5,Faldo,33,Former army officer and trainee stuntwoman,"West Molesey, Surrey","Ginger, Fig and Honey Steamed School Pudding","Raspberry, Yuzu & White Chocolate Bûche Trifle Terrine",1
Sophie,IN,8,6,Faldo,33,Former army officer and trainee stuntwoman,"West Molesey, Surrey",'The Four Seasons' Decorative Pies,Game Pie with Glazed Forest Fruits,2
Sophie,IN,8,7,Faldo,33,Former army officer and trainee stuntwoman,"West Molesey, Surrey",'Classics with a Twist' Cannoli,'Classics' Sfogliatelle,3
Sophie,IN,8,8,Faldo,33,Former army officer and trainee stuntwoman,"West Molesey, Surrey",Char Siu & Banana Praline Bedfordshire Clangers,Citrus with Green Apple Croquembouche Savoy Cake,4
Sophie,STAR BAKER,8,9,Faldo,33,Former army officer and trainee stuntwoman,"West Molesey, Surrey",Strawberry & Rhubarb and Chestnut & Vanilla Choux Buns,'Tutu with Opera Filling' Meringue Centrepiece,1
Sophie,WINNER,8,10,Faldo,33,Former army officer and trainee stuntwoman,"West Molesey, Surrey","Spelt Boules, Mushroom Ciabatta and Orange Plaited Brioche",'Ode to the Honey Bee' Entremet,2
Stacey,IN,8,1,Hart,42,Former school teacher,"Radlett, Hertfordshire",Granny Smith Apple and Walnut Cake,'Black Evening Clutch Bag' Cake,11
Stacey,IN,8,2,Hart,42,Former school teacher,"Radlett, Hertfordshire",Sparkly Chocolate and Marshmallow Fluff Cookies,'Get to School' Game,9
Stacey,IN,8,3,Hart,42,Former school teacher,"Radlett, Hertfordshire",Cranberry and Cinnamon Teacakes,'Ascot Hat' Bread Sculpture,1
Stacey,IN,8,4,Hart,42,Former school teacher,"Radlett, Hertfordshire",Rum Salted Caramel Millionaire Shortbreads,Chocolate and Coffee Caramel Cake,1
Stacey,IN,8,5,Hart,42,Former school teacher,"Radlett, Hertfordshire",Bakewell Tart Steamed School Pudding,Tropical Trifle Terrine,4
Stacey,IN,8,6,Hart,42,Former school teacher,"Radlett, Hertfordshire",'Love Theme' Decorative Pies,Indian Hand Raised Pie with Mango,6
Stacey,IN,8,7,Hart,42,Former school teacher,"Radlett, Hertfordshire",My All Time Favourite Desserts,Pastry Surprise,4
Stacey,STAR BAKER,8,8,Hart,42,Former school teacher,"Radlett, Hertfordshire",Camembert & Onion and Apple & Blueberry Bedfordshire Clangers,'Bright' Lemon & Orange Savoy Cake,3
Stacey,OUT,8,9,Hart,42,Former school teacher,"Radlett, Hertfordshire",'Choux-nicorn and Choux-moji' Choux Buns,'Flamingos in Love' Meringue Centrepiece,2
Steph,IN,10,1,NA,NA,NA,NA,NA,NA,3
Steph,IN,10,2,NA,NA,NA,NA,NA,NA,10
Steph,IN,10,3,NA,NA,NA,NA,NA,NA,3
Steph,STAR BAKER,10,4,NA,NA,NA,NA,NA,NA,1
Steph,STAR BAKER,10,5,NA,NA,NA,NA,NA,NA,4
Steph,STAR BAKER,10,6,NA,NA,NA,NA,NA,NA,3
Steph,IN,10,7,NA,NA,NA,NA,NA,NA,4
Steph,STAR BAKER,10,8,NA,NA,NA,NA,NA,NA,4
Steph,IN,10,9,NA,NA,NA,NA,NA,NA,3
Steph,Runner-up,10,10,NA,NA,NA,NA,NA,NA,3
Steven,STAR BAKER,8,1,Carter-Bailey,34,Marketer,"Watford, Hertfordshire",Bonfire Night Cake,'A Baker's Lunch' Cake,6
Steven,STAR BAKER,8,2,Carter-Bailey,34,Marketer,"Watford, Hertfordshire",Amarpressi Biscuits,'Check Bake' Game,6
Steven,IN,8,3,Carter-Bailey,34,Marketer,"Watford, Hertfordshire",Madras Cocktail Teacakes,'The Bag I Knead' Bread Sculpture,3
Steven,IN,8,4,Carter-Bailey,34,Marketer,"Watford, Hertfordshire",Orange Macadamia Nut Millionaire Shortbreads,Caramel Crown Cake,7
Steven,IN,8,5,Carter-Bailey,34,Marketer,"Watford, Hertfordshire",Lemon & Blackcurrant Drizzle Steamed School Pudding,'From Across the Jelly Pond' Trifle Terrine,5
Steven,IN,8,6,Carter-Bailey,34,Marketer,"Watford, Hertfordshire",'Fleetwood Mac' Decorative Pies,Christmas Pie,3
Steven,STAR BAKER,8,7,Carter-Bailey,34,Marketer,"Watford, Hertfordshire",Italian Style Cannoli,'Sicilian-style' Sfogliatelle,1
Steven,IN,8,8,Carter-Bailey,34,Marketer,"Watford, Hertfordshire",'Mediterranean Medley' Bedfordshire Clangers,Chestnut Rum Savoy Cake,1
Steven,IN,8,9,Carter-Bailey,34,Marketer,"Watford, Hertfordshire",Key Lime Cheesecake and Bakewell Tart Choux Buns,'Some Air Over the Rainbow' Meringue Centrepiece,3
Steven,Runner-up,8,10,Carter-Bailey,34,Marketer,"Watford, Hertfordshire","Spelt & Rye, Toasted Garlic & Fontina and Sweet Chocolate Breads",'Yin Yang' Entremet,1
Stu,OUT,6,1,Henshall,35,Professional musician,"Guildford, Surrey",Marley Madeira Cake,Purple Forest Gâteau,11
Stuart,IN,3,1,Marston-Smith,26,PE teacher,"Lichfield, Staffordshire",Tomato and Ginger,Lemon and Pistachio Union Flag Cake,9
Stuart,IN,3,2,Marston-Smith,26,PE teacher,"Lichfield, Staffordshire",Bombay BreadChorizo and Spring Onion Naan,"Cinnamon and Cranberry Bagels
Tomato and Thyme Bagels",9
Stuart,IN,3,3,Marston-Smith,26,PE teacher,"Lichfield, Staffordshire",Pear and Almond Tarte Tatin,Raspberry Triple Chocolate Layered Tart,7
Stuart,OUT,3,4,Marston-Smith,26,PE teacher,"Lichfield, Staffordshire",Black Forest Torte,Choca Blocka Mocha Meringue,8
Tamal,IN,6,1,Ray,29,Trainee anaesthetist,Manchester,Pistachio and Rose Madeira Cake,Black Forest Gâteau in a Chocolate Shell,4
Tamal,IN,6,2,Ray,29,Trainee anaesthetist,Manchester,"Cinnamon, Maple and Cranberry Biscotti",Chessboard Box,8
Tamal,IN,6,3,Ray,29,Trainee anaesthetist,Manchester,"Fig, Cheese and Walnut Breads",Breadcycle,3
Tamal,IN,6,4,Ray,29,Trainee anaesthetist,Manchester,Rhubarb and Ginger Crème Brûlées,"Mango, Hazelnut and Rosemary Cheesecake Trio",5
Tamal,IN,6,5,Ray,29,Trainee anaesthetist,Manchester,Honey and Grapefruit Polenta Cake,Passion Fruit and Pineapple Ice Cream Roll,7
Tamal,IN,6,6,Ray,29,Trainee anaesthetist,Manchester,Spiced Pear Frangipane Tart,Fennel and Rosemary Pulled Pork and Chicken and Coriander vol-au-vents,7
Tamal,STAR BAKER,6,7,Ray,29,Trainee anaesthetist,Manchester,Middle Eastern Game Pie,"Spiced Blackberry, Raspberry and Cardamom Charlotte Russe",3
Tamal,IN,6,8,Ray,29,Trainee anaesthetist,Manchester,Lime & Mascarpone and Malt Cream Horns,Passionfruit & Mango and Pistachio & Raspberry Religieuse à l'ancienne,4
Tamal,IN,6,9,Ray,29,Trainee anaesthetist,Manchester,Chocolate New York Pie,Chocolate Bell Tower,2
Tamal,Runner-up,6,10,Ray,29,Trainee anaesthetist,Manchester,Cinnamon and Apple & Toffee and Marmalade Iced Buns,Sticky Toffee Pudding Cake,3
Terry,IN,9,1,NA,NA,NA,NA,NA,NA,9
Terry,IN,9,2,NA,NA,NA,NA,NA,NA,8
Terry,IN,9,3,NA,NA,NA,NA,NA,NA,1
Terry,[a],9,4,NA,NA,NA,NA,NA,NA,NA
Terry,OUT,9,5,NA,NA,NA,NA,NA,NA,8
Toby,OUT,4,1,Waterworth,30,Web Programmer,"Reading, Berkshire",Spiced and Iced Carrot Cake,Two Tiered Chocolate Cake,13
Tom,IN,7,1,Gilliford,26,Project engagement manager,Rochdale,G&T Drizzle Cake,Black Forest Broken Mirror,2
Tom,IN,7,2,Gilliford,26,Project engagement manager,Rochdale,Chai Frappelatteccino Biscuits,Tom and Pod's Near Death Experience,7
Tom,STAR BAKER,7,3,Gilliford,26,Project engagement manager,Rochdale,Chocolate Orange and Chilli Swirl Bread,Jörmungandr and Mjölnir,4
Tom,IN,7,4,Gilliford,26,Project engagement manager,Rochdale,West Yorkshire Fusion Puddings,Fennel Churros Snake In The Grass,5
Tom,IN,7,5,Gilliford,26,Project engagement manager,Rochdale,Mega Breakfast Bonanzas; Granola Spirals and Wheat Foldovers,Yin and Yang Amuse-bouche,4
Tom,STAR BAKER,7,6,Gilliford,26,Project engagement manager,Rochdale,Blood Orange Halloween Pumpkin Pie,Floral Tea Cake,1
Tom,OUT,7,7,Gilliford,26,Project engagement manager,Rochdale,Millionaire's Roulade,Hipster Picnic,5
Tom,IN,8,1,Hetherington,29,Architect,Edinburgh,Gilded Pear and Cardamom Cake,'Stack of Books' Cake,7
Tom,IN,8,2,Hetherington,29,Architect,Edinburgh,Coffee and Amaretto Kisses,'Drain Pipes and Ladders' Game,5
Tom,IN,8,3,Hetherington,29,Architect,Edinburgh,Orange and Cranberry Teacakes,'Pink & Yellow Rose Centrepiece' Bread Sculpture,4
Tom,OUT,8,4,Hetherington,29,Architect,Edinburgh,Stem Ginger Caramel Shortbreads,Hummingbird Cake,5
