first_name,result,series,episode,last_name,baker_age,baker_occupation,hometown,signature_bake,show_stopper,technical
Ugnė,IN,6,1,Bubnaityte,32,PA and administrator,"Woodford, London / Vilkaviškis, Lithuania",Lemon and Thyme Madeira Cake,Falling Cup Gâteau,1
Ugnė,IN,6,2,Bubnaityte,32,PA and administrator,"Woodford, London / Vilkaviškis, Lithuania",White Wine Biscotti,Baby Climbing into the Cookie Box,7
Ugnė,IN,6,3,Bubnaityte,32,PA and administrator,"Woodford, London / Vilkaviškis, Lithuania",Chocolate Quick Breads with Salted Caramel Sauce,Easter Basket,5
Ugnė,IN,6,4,Bubnaityte,32,PA and administrator,"Woodford, London / Vilkaviškis, Lithuania",Marula Fruit and Coffee Liqueur Crème Brûlées,"Lime, Coconut and Hazelnut Cheesecakes",2
Ugnė,OUT,6,5,Bubnaityte,32,PA and administrator,"Woodford, London / Vilkaviškis, Lithuania",Chocolate and Hazelnut Sugar-Free Cake,"Chocolate, Peanut Butter and Grape Jam Roll",6
Urvashi,IN,2,1,Roe,40,Head of Marketing,"Enfield, London",Cherry Blossom CupcakesJapanese Lime Cupcakes,UNKNOWN,7
Urvashi,IN,2,2,Roe,40,Head of Marketing,"Enfield, London","Crab, Coriander and Coconut Quiche",Strawberry and Basil TartsElderflower and Honeycomb Tarts,7
Urvashi,OUT,2,3,Roe,40,Head of Marketing,"Enfield, London",Salt and Peppercorn Loaf,Chilli and Halloumi RollsLemon and Coriander Mini Loaves,9
Val,IN,7,1,Stones,66,"Semi-retired, Substitute teacher",Yeovil,Mum's Orange and Lemon Drizzle,Chocolate Sponge with Four Fruit Frosting,10
Val,IN,7,2,Stones,66,"Semi-retired, Substitute teacher",Yeovil,Sunday Treat Iced Ice Cream Cone Biscuits,From Holland to New York via Yorkshire,5
Val,IN,7,3,Stones,66,"Semi-retired, Substitute teacher",Yeovil,Double Chocolate Cinnamon Twist Loaf,"""And They All Went Into The Ark To Get Out Of The Rain""",1
Val,IN,7,4,Stones,66,"Semi-retired, Substitute teacher",Yeovil,Mum's Chilli Yorkshire Puddings,Orange Chocolate Churros,6
Val,OUT,7,5,Stones,66,"Semi-retired, Substitute teacher",Yeovil,"Pecan and Maple Syrup Pinwheels and Apple, Sultana and Cinnamon Swirls","Caramelised Red Onion, Goats Cheese Tartlets and Mincemeat and Apple Spiced Parcels",7
Victoria,STAR BAKER,3,1,Chester,50,CEO of the charity Plantlife,Somerset,Pear and Pecan,Blackbird Pie Cake,4
Victoria,IN,3,2,Chester,50,CEO of the charity Plantlife,Somerset,Coriander and Lemon NaanGarlic and Parsnip Chapatis,"Saffron and Golden Raisin Bagels
Porcini Bagels",7
Victoria,OUT,3,3,Chester,50,CEO of the charity Plantlife,Somerset,"Fig, Walnut and Pink Peppercorn Tarte Tatin",Tropical Fruit Tart with Black Pepper Crust,4
Yan,IN,8,1,Tsou,46,Laboratory research scientist,North London,Windfall Apple Crumble Cake,'Banana-ramen' Cake,4
Yan,IN,8,2,Tsou,46,Laboratory research scientist,North London,'Mrs. Marian's PB 'n' B' Biscuits,'Adventures in Bakeland' Game,1
Yan,IN,8,3,Tsou,46,Laboratory research scientist,North London,'Mrs P's' Masala Chai Spiced Teacakes,'Basil the Vegetarian Dragon with his Pumpkin Hoard' Bread Sculpture,8
Yan,IN,8,4,Tsou,46,Laboratory research scientist,North London,'Lil' Red's Ginger and Nuts' Millionaire Shortbreads,Animals of the Rainforest Caramel Cake,8
Yan,IN,8,5,Tsou,46,Laboratory research scientist,North London,Mango Fruit Hat Steamed School Pudding,'Heart of a Hero' Trifle Terrine,6
Yan,IN,8,6,Tsou,46,Laboratory research scientist,North London,'πr2' Decorative Pies,Chequerboard Pie,1
Yan,OUT,8,7,Tsou,46,Laboratory research scientist,North London,Cannoli Cocktails,Canadian-Style Sfogliatelle,5
Yasmin,IN,2,1,Limbert,43,Childminder,"West Kirby, The Wirral",Cardamom and Pomegranate Cupcakes,UNKNOWN,5
Yasmin,IN,2,2,Limbert,43,Childminder,"West Kirby, The Wirral",Smoked Haddock and Watercress Quiche,Chocolate and Orange with Cinnamon-Orange Pastry TartsBlueberry and Hazelnut with Hazelnut Pastry Tarts,6
Yasmin,STAR BAKER,2,3,Limbert,43,Childminder,"West Kirby, The Wirral",Egyptian Dukkah Loaf with Mixed Spices,"Pesto Bread
Sweet Coconut Rolls",2
Yasmin,IN,2,4,Limbert,43,Childminder,"West Kirby, The Wirral",Chocolate Chip and Pistachio Biscotti,Chocolate and Lime MacaronsCoffee and Walnut MacaronsPineapple and Coconut Macarons,6
Yasmin,IN,2,5,Limbert,43,Childminder,"West Kirby, The Wirral",Family Fish Pie,Peach and Raspberry Meringue Pie,5
Yasmin,OUT,2,6,Limbert,43,Childminder,"West Kirby, The Wirral",Baked Amaretto Cheesecake,Rose Croquembouche,2
